{
  "subject": {
    "principal_type": "human",
    "principal_id": "human-engineering-lead-01"
  },
  "role": "decision_authority",
  "authority_scope": {
    "operations": [
      "decision.create",
      "decision.next_version"
    ],
    "decision_subjects": [
      "motor_driver_selection"
    ]
  },
  "status": "active",
  "valid_from": "2026-08-04T15:03:00Z",
  "assignment_reason": "approve motor-driver selection decisions"
}
