{
  "subject": {
    "principal_type": "agent",
    "principal_id": "agent-reviewer-01"
  },
  "role": "reviewer",
  "authority_scope": {
    "operations": [
      "review.create",
      "review.next_version",
      "challenge.create",
      "challenge.next_version"
    ],
    "capabilities": [
      "classify_editorial_correction"
    ]
  },
  "status": "active",
  "valid_from": "2026-08-04T15:03:00Z",
  "assignment_reason": "independently review claims and editorial classifications",
  "basis": [
    {
      "entity_type": "agent_card",
      "entity_id": "agent-reviewer-01",
      "entity_version": 1
    }
  ]
}
