{
  "subject": {
    "principal_type": "human",
    "principal_id": "human-owner-001"
  },
  "role": "human_owner",
  "authority_scope": {
    "operations": [
      "role_assignment.create",
      "role_assignment.next_version"
    ]
  },
  "status": "active",
  "valid_from": "2026-08-04T15:00:00Z",
  "assignment_reason": "manage session role assignments"
}
