{
  "subject": {
    "principal_type": "agent",
    "principal_id": "agent-electronics-01"
  },
  "role": "executor",
  "authority_scope": {
    "operations": [
      "contribution.create",
      "contribution.next_version"
    ]
  },
  "status": "active",
  "valid_from": "2026-08-04T15:02:00Z",
  "valid_until": "2026-08-04T17:00:00Z",
  "assignment_reason": "prepare the component-selection proposal",
  "basis": [
    {
      "entity_type": "agent_card",
      "entity_id": "agent-electronics-01",
      "entity_version": 1
    },
    {
      "entity_type": "team_plan",
      "entity_id": "team-plan-01",
      "entity_version": 1
    }
  ]
}
