{
  "subject": {
    "principal_type": "service",
    "principal_id": "orchestrator-service-01"
  },
  "role": "orchestrator",
  "authority_scope": {
    "operations": [
      "task.create",
      "task.next_version"
    ]
  },
  "status": "suspended",
  "valid_from": "2026-08-04T15:00:00Z",
  "status_reason": "manual integrity review in progress",
  "assignment_reason": "coordinate bounded task execution"
}
